{
  "receipt_id": "RR-WP0003-ACTIVATE-20260716",
  "issued_at": "2026-07-16T19:41:34Z",
  "issued_by": "AC-21",
  "issuer_role": "creator",
  "receipt_kind": "packet-activation",
  "artifact_resolver": {
    "type": "external-protected",
    "resolver_reference": "https://github.com/AC-21/sasha-the-land-pirate/pull/20#issuecomment-4995902223"
  },
  "source_reference": "https://github.com/AC-21/sasha-the-land-pirate/pull/20#issuecomment-4995902223",
  "subject_ids": ["WP-0003"],
  "subject_claims": [
    {
      "subject_id": "WP-0003",
      "claims": [
        "A1-LOCAL-BOUNDARY-VERIFIED",
        "ACTIVATE-A1-WP-0003"
      ]
    }
  ],
  "approval_text_sha256": "95287f82ea301e326dc8ea2340e188ab28e961b1e775fa94684f16ecc44929f7",
  "accepted_commit": "0080c1e9d65b77adf3726d9eaa657b3738330da2",
  "artifact_sha256": {
    "github.com/AC-21/sasha-the-land-pirate/pull/20#issuecomment-4995902223": "95287f82ea301e326dc8ea2340e188ab28e961b1e775fa94684f16ecc44929f7",
    "governance/a1-boundaries/WP-0003.json": "f495286de7c1ef4b762de8fb8e4603e59c5eaee7b0cf0c27bb6c73268760722b",
    "governance/ratification-state.json": "d8d2ba5e554acf182b288153528b4d63066c3dbfe0825aef27adca56745408b0",
    "work-packets/proposed/WP-0003.json": "0b11fe78db1c2a49b6e01b345771eebdaf5574d2ed80b62c9fa7cfd0e29004d4"
  },
  "subject_contract_sha256": {
    "WP-0003": "fb8b7362f3c6915447964e134486123ede6d8b22430fe744f5c0a03c0537bd47"
  },
  "subject_event_sha256": {},
  "foundation_binding": {
    "constitution_sha256": "ff6d7938c14a074acf796619868b97551cefd1681147559983a293792c20afb8",
    "decision_ledger_sha256": "df5a4840f468676d6e3b428be1eda957310ef12c812241c5be3cdde6bd4601ef",
    "last_creator_receipt_id": "RR-WP0003-ACCEPT-20260716"
  },
  "signature_reference": "https://github.com/AC-21/sasha-the-land-pirate/pull/20#issuecomment-4995902223",
  "sealed": true
}
