{
  "receipt_id": "RR-WP0001-ROUTE-20260716",
  "issued_at": "2026-07-16T07:46:03Z",
  "issued_by": "AC-21",
  "issuer_role": "creator",
  "receipt_kind": "packet-acceptance",
  "artifact_resolver": {
    "type": "external-protected",
    "resolver_reference": "https://github.com/AC-21/sasha-the-land-pirate/pull/6#issuecomment-4989428688"
  },
  "source_reference": "https://github.com/AC-21/sasha-the-land-pirate/pull/6#issuecomment-4989428688",
  "subject_ids": ["WP-0001"],
  "subject_claims": [
    {
      "subject_id": "WP-0001",
      "claims": [
        "ACCEPT-WP-0001-ROUTE-SUCCESSOR",
        "UNITY-MCP-EXTERNAL",
        "PRESERVE-ACCEPTED-WP0001-CONTRACT"
      ]
    }
  ],
  "approval_text_sha256": "b7984d1fdea5adc552ec8ac4ba6ee8650c1af0ab50e375801264491543fcc3df",
  "accepted_commit": "08fdb95e4981b4b7062a2c3991d6753611f23ad5",
  "artifact_sha256": {
    "github.com/AC-21/sasha-the-land-pirate/pull/6#issuecomment-4989428688": "b7984d1fdea5adc552ec8ac4ba6ee8650c1af0ab50e375801264491543fcc3df",
    "work-packets/proposed/WP-0001.json": "70035d37fb9c7e525a4f774c0997b518e39f16484e4c706fcce1b1b4e7abec56"
  },
  "subject_contract_sha256": {
    "WP-0001": "eed333603affe6aa1dd2b16b26ae702d9f561cc653fa319da02abfe008faeda3"
  },
  "subject_event_sha256": {},
  "foundation_binding": null,
  "signature_reference": "https://github.com/AC-21/sasha-the-land-pirate/pull/6#issuecomment-4989428688",
  "sealed": true
}
