{
  "receipt_id": "RR-WP0001-ACCEPT-20260715",
  "issued_at": "2026-07-15T22:04:24-07:00",
  "issued_by": "AC-21",
  "issuer_role": "creator",
  "receipt_kind": "packet-acceptance",
  "artifact_resolver": {
    "type": "external-protected",
    "resolver_reference": "https://github.com/AC-21/sasha-the-land-pirate/pull/2#issuecomment-4988383552"
  },
  "source_reference": "https://github.com/AC-21/sasha-the-land-pirate/pull/2#issuecomment-4988383552",
  "subject_ids": ["WP-0001"],
  "subject_claims": [
    {
      "subject_id": "WP-0001",
      "claims": [
        "ACCEPT-WP-0001",
        "AUTHORIZE-TEMP-WP0001-IDENTITY",
        "APPROVE-REPOSITORY-LOCATION",
        "APPROVE-UNITY-INSTALLATION",
        "UNITY-AI-GATEWAY-CODEX"
      ]
    }
  ],
  "approval_text_sha256": "ac2e4215d9f570db34279009a4c9b961d34d30df3e740e819338fde8b81282ae",
  "accepted_commit": "ed14ae664e7c0efea790d334546538584e85c083",
  "artifact_sha256": {
    "github.com/AC-21/sasha-the-land-pirate/pull/2#issuecomment-4988383552": "ac2e4215d9f570db34279009a4c9b961d34d30df3e740e819338fde8b81282ae",
    "work-packets/proposed/WP-0001.json": "3824a6a67b7d62427341a5d798da986ba7420086adf75d1080ca0389f03c926a"
  },
  "subject_contract_sha256": {
    "WP-0001": "eed333603affe6aa1dd2b16b26ae702d9f561cc653fa319da02abfe008faeda3"
  },
  "subject_event_sha256": {},
  "foundation_binding": null,
  "signature_reference": "https://github.com/AC-21/sasha-the-land-pirate/pull/2#issuecomment-4988383552",
  "sealed": true
}
